{
  "$schema": "http://json-schema.org/draft-07/schema#",
  "title": "ExtractedEntity",
  "type": "object",
  "required": ["title", "url", "timestamp", "author"],
  "properties": {
    "title": { "type": "string", "minLength": 1 },
    "url": { "type": "string", "format": "uri" },
    "timestamp": { "type": "string", "format": "date-time" },
    "author": { "type": "string" },
    "tags": { "type": "array", "items": { "type": "string" } },
    "content": { "type": "string" }
  },
  "additionalProperties": false
}
