{
  "title": "Hacker News",
  "url": "https://news.ycombinator.com",
  "timestamp": "2026-06-25T12:43:09.886573Z",
  "author": "G.O.D. Stack Ingestion Engine",
  "tags": [
    "automated",
    "raw_capture"
  ],
  "content": "<html lang=\"en\" op=\"news\"><head><meta name=\"referrer\" content=\"origin\"><meta name=\"viewport\" content=\"width=device-width, initial-scale=1.0\"><link rel=\"stylesheet\" type=\"text/css\" href=\"news.css?rbDKZB3Gz3kvhIuyRiN1\"><link rel=\"icon\" href=\"y18.svg\"><link rel=\"alternate\" type=\"application/rss+xml\" title=\"RSS\" href=\"rss\"><title>Hacker News</title></head><body><center><table id=\"hnmain\" border=\"0\" cellpadding=\"0\" cellspacing=\"0\" width=\"85%\" bgcolor=\"#f6f6ef\"><tbody><tr><td bgcolor=\"#ff6600\"><table border=\"0\" cellpadding=\"0\" cellspacing=\"0\" width=\"100%\" style=\"padding:2px\"><tbody><tr><td style=\"width:18px;padding-right:4px\"><a href=\"https://news.ycombinator.com\"><img src=\"y18.svg\" width=\"18\" height=\"18\" style=\"border:1px white solid; display:block\"></a></td><td style=\"line-height:12pt; height:10px;\"><span class=\"pagetop\"><b class=\"hnname\"><a href=\"news\">Hacker News</a></b><a href=\"newest\">new</a> | <a href=\"front\">past</a> | <a href=\"newcomments\">comments</a> | <a href=\"ask\">ask</a> | <a href=\"show\">show</a> | <a href=\"jobs\">jobs</a> | <a href=\"submit\" rel=\"nofollow\">submit</a></span></td><td style=\"text-align:right;padding-right:4px;\"><span class=\"pagetop\"><a href=\"login?goto=news\">login</a></span></td></tr></tbody></table></td></tr><tr style=\"height:10px\"></tr><tr id=\"bigbox\"><td><table border=\"0\" cellpadding=\"0\" cellspacing=\"0\"><tbody><tr class=\"athing submission\" id=\"48671392\"><td align=\"right\" valign=\"top\" class=\"title\"><span class=\"rank\">1.</span></td><td valign=\"top\" class=\"votelinks\"><center><a id=\"up_48671392\" href=\"vote?id=48671392&amp;how=up&amp;goto=news\"><div class=\"votearrow\" title=\"upvote\"></div></a></center></td><td class=\"title\"><span class=\"titleline\"><a href=\"https://dolphin-emu.org/blog/2026/06/25/dolphin-progress-report-release-2606/\">Dolphin Emulator Progress Release 2606</a><span class=\"sitebit comhead\"> (<a href=\"from?site=dolphin-emu.org\"><span class=\"sitestr\">dolphin-emu.org</span></a>)</span></span></td></tr><tr><td colspan=\"2\"></td><td class=\"subtext\"><span class=\"subline\"><span class=\"score\" id=\"score_48671392\">59 points</span> by <a href=\"user?id=exploraz\" class=\"hnuser\">exploraz</a> <span class=\"age\" title=\"2026-06-25T10:20:07 1782382807\"><a href=\"item?id=48671392\">1 hour ago</a></span> <span id=\"unv_48671392\"></span> | <a href=\"hide?id=48671392&amp;goto=news\">hide</a> | <a href=\"item?id=48671392\">5&nbsp;comments</a></span></td></tr><tr class=\"spacer\" style=\"height:5px\"></tr><tr class=\"athing submission\" id=\"48669534\"><td align=\"right\" valign=\"top\" class=\"title\"><span class=\"rank\">2.</span></td><td valign=\"top\" class=\"votelinks\"><center><a id=\"up_48669534\" href=\"vote?id=48669534&amp;how=up&amp;goto=news\"><div class=\"votearrow\" title=\"upvote\"></div></a></center></td><td class=\"title\"><span class=\"titleline\"><a href=\"https://hl2.slqnt.dev/\">Half-Life 2 in a Browser</a><span class=\"sitebit comhead\"> (<a href=\"from?site=slqnt.dev\"><span class=\"sitestr\">slqnt.dev</span></a>)</span></span></td></tr><tr><td colspan=\"2\"></td><td class=\"subtext\"><span class=\"subline\"><span class=\"score\" id=\"score_48669534\">313 points</span> by <a href=\"user?id=panza\" class=\"hnuser\">panza</a> <span class=\"age\" title=\"2026-06-25T06:00:04 1782367204\"><a href=\"item?id=48669534\">5 hours ago</a></span> <span id=\"unv_48669534\"></span> | <a href=\"hide?id=48669534&amp;goto=news\">hide</a> | <a href=\"item?id=48669534\">115&nbsp;comments</a></span></td></tr><tr class=\"spacer\" style=\"height:5px\"></tr><tr class=\"athing submission\" id=\"48664814\"><td align=\"right\" valign=\"top\" class=\"title\"><span class=\"rank\">3.</span></td><td valign=\"top\" class=\"votelinks\"><center><a id=\"up_48664814\" href=\"vote?id=48664814&amp;how=up&amp;goto=news\"><div class=\"votearrow\" title=\"upvote\"></div></a></center></td><td class=\"title\"><span class=\"titleline\"><a href=\"https://www.reuters.com/world/china/anthropic-says-alibaba-illicitly-extracted-claude-ai-model-capabilities-2026-06-24/\">Anthropic says Alibaba illicitly extracted Claude AI model capabilities</a><span class=\"sitebit comhead\"> (<a href=\"from?site=reuters.com\"><span class=\"sitestr\">reuters.com</span></a>)</span></span></td></tr><tr><td colspan=\"2\"></td><td class=\"subtext\"><span class=\"subline\"><span class=\"score\" id=\"score_48664814\">469 points</span> by <a href=\"user?id=htrp\" class=\"hnuser\">htrp</a> <span class=\"age\" title=\"2026-06-24T19:48:01 1782330481\"><a href=\"item?id=48664814\">12 hours ago</a></span> <span id=\"unv_48664814\"></span> | <a href=\"hide?id=48664814&amp;goto=news\">hide</a> | <a href=\"item?id=48664814\">831&nbsp;comments</a></span></td></tr><tr class=\"spacer\" style=\"height:5px\"></tr><tr class=\"athing submission\" id=\"48663324\"><td align=\"right\" valign=\"top\" class=\"title\"><span class=\"rank\">4.</span></td><td valign=\"top\" class=\"votelinks\"><center><a id=\"up_48663324\" href=\"vote?id=48663324&amp;how=up&amp;goto=news\"><div class=\"votearrow\" title=\"upvote\"></div></a></center></td><td class=\"title\"><span class=\"titleline\"><a href=\"https://techcrunch.com/2026/06/24/openai-unveils-"
}